title,alternate_titles,region,country,publisher,developer,release_date,players,coop,genre,esrb_rating,description
"137E0 Action 1 Steak","","Other","","","","2016-05-06","1","No","Action","E - Everyone","A joke rom hack made for the Sonic Hacking Contest 2016."
"Battle Master","","Region Not Set","","Mirrorsoft Ltd.","PSS","1990-01-01","1","No","Strategy","E - Everyone","Battle Master is a 1990 fantasy action adventure game designed by Mike Simpson and Simon Jones[citation needed] for PSS and distributed by Mirrorsoft. The game is a fantasy adventure in which the player controls a champion who must battle evil forces to conquer four kingdoms, uniting the four kings' crowns and presenting them to the Watcher in order to restore the world to peace.

Battle Master is a squad-based action-adventure game viewed from a top-down isometric perspective.

After choosing a race - human, elf, dwarf or orc - and a Dungeons & Dragons-style class - warrior, merchant, archer or mage - the player is presented with a map, from which destinations are chosen. At each destination the player may choose to parley - giving an opportunity to purchase useful items from the destination, rather than having to find them - or may enter the destination."
"Battletech: A Game of Armored Combat","","Region Not Set","","Extreme Entertainment Group","Malibu Interactive","","","No","Action","","The 31st century is a brutal and violent place. The galaxy is racked by a devastating war waged with gigantic 75-ton BattleMechs teeming with the most ruinous weapons that science can create. MechWarriors like you are needed to pilot the ""Madcat"" Heavy OmniMech on desperate missions against enemy installations! This is the world of BATTLETECH! Alone against the relentless onslaught of hordes of enemy defenders, you'll need skill and cunning to knock out your objectives. Steer your lumbering 'Mech into the savage fury of a hornet's nest of attackers, and cut loose with the Madcat's incredible firepower to lay waste to all before you! Fight to the last for a victory that will bring you honor and glory! And if honor isn't motivation enough, it helps to remember that the enemy doesn't take prisoners...

The game has the player control a Mech outfitted with an arsenal of missiles and energy weapons in missions that take place on a large map. The player can freely roam around and explore the mission's map before tackling the objectives of the stage. The main single player mode in the came is a campaign that tasks them with several objectives spanning various missions. These can be getting to objective points, clearing out enemies, or escorting convoys across the map. The game contains a cooperative two player mode where one player controls the bottom half of the Mech to navigate it around the battlefield while the other player controls the top half of the Mech and its arsenal independently."
"Battletoads & Double Dragon","","Region Not Set","","Tradewest, Inc.","Rare, Ltd.","1993-06-01","2","Yes","Action","","When a battlecruiser the size of a city and called the Colossus smashes out of the moon, its laser cannon glowing menacingly, you can bet it ain't gonna be makin' no social calls... You can bet it's gonna be creating some bad n' crazy mayhem on good ol' planet Earth - 'specially when you know that the dreaded Dark Queen and the shady Shadow Boss are on board just rarin' to rock n' roll... The dastardly duo are about to unleash their most monstrous plan yet - from their secret lunar base they intend to launch an invasion that'll make them masters of the world... Neutralized by deadly glooming rays, Earth's forces are powerless... That is, until the Dragons join the 'Toads! Take a 'toadacious trip with the dream ticket as those terrific twins Billy and Jimmy Lee team up with Zitz, Flash and Pimple against the combined might of the gruesome twosome and their mindless minions Big Blag, Abobo, Robo-Manus and Roper, in a 'toadally terminal new adventure! So lets get mad, bad n' crazy once again as the BATTLETOADS join DOUBLE DRAGON in THE ULTIMATE TEAM!"
"Bimini Run","","Region Not Set","","Nuvision Entertainment","Microsmiths Inc.","1990-10-10","1","No","Racing","","Bimini Run is an early third person shooter/action video game for the Sega Mega Drive/Genesis. It was developed and published by Nuvision Entertainment. Since it was a two-player game, Bimini Run allowed both players to traverse a wide scrolling environment on objective based missions."
"Caliber.50","","Region Not Set","","Mentrix Software","Visco Corporation","1991-01-01","1","No","Shooter","Not Rated","Caliber.50 is a top-down run and gun video game originally released in arcades (as Cal.50) before being brought to the Sega Mega Drive in 1991. The Mega Drive version was only released in North America.
The Mega Drive version is severely watered down from the arcade original, not just in terms of graphics and sound, but also gameplay, as the controls need to be mapped to three buttons. This means unlike the arcade original B takes the roll of shooting and throwing grenades, A rotates left and C rotates right. The arcade cabinet used special joysticks which could be spun around to rotate the player. To compenstate, there are fewer enemies on screen, and the player is given a life bar."
"City Connection","City Connection","PAL","","Jaleco Ltd.","Jaleco Ltd.","2023-11-27","1","No","Action","E - Everyone","Clarice, a speed-crazed girl born in California, is driving around the world's highways and causing havoc in every country! She is no stranger to police chasing her around the world. She hits oil, spins around, and hits them with her car, sending them flying. A crazy panic car chase between Clarice and police unfolds against a beautiful backdrop!"
"Clan of Heroes: Generals of the Yang Family","","Region Not Set","","Piko Interactive LLC","","","2","No","Action | Adventure","E - Everyone","Clan of Warriors - Generals of the Yang Family is a beat'em up that is based off the story several old Chinese stories and Folklore Songs.

Choose between 4 playable warriors to defend your country from foreign military invaders.

This title was originally released exclusively in China. Piko Interactive acquired the full rights of the game to localize it to English speaking players. The game has been completely re-hauled fixing many of the original bugs and play ability problems. There is a lot of polishing done to the fighting and collision engine. Over all the game was worked up to be finally enjoyable from beginning to end."
"Cliffhanger","","Region Not Set","","Sony","","1993-01-01","1","No","Action | Fighting","","Standard side-scrolling fighter based off of the Stallone film of the same name. Sly must fight thugs and the elements as he tracks down suitcases of stolen cash dropped around the peaks of the Rockies."
"Clue","","Region Not Set","","","","","","No","","","Up to six players can play, using any controller. The object of the game, as in the board game, is to find out who killed Mr. Boddy where and with what.

Each player is dealt a number of cards. All the cards held eliminate the suspect, weapon, or room on the card. Each player can view their own cards during their turn. A die is rolled, and the six players (represented by the six suspects Miss Scarlet, Col. Mustard, Mrs. White, Mr. Green, Mrs. Peacock, and Prof. Plum(Know as Prof. Fart[citation needed] in Brazil)) move around the board. Upon entering one of the nine rooms on the board, the player must make a suggestion, choosing a suspect and a weapon (the room the player is in is automatically chosen.) A vignette is shown, showing who or what was in that room, or who held the weapon. This would result in a clue given, such as ""Miss Scarlet was in the Lounge"" or ""No one had the wrench."" On the highest difficulty, the clues given are less broad, like in the board game, with clues only given that the chosen suspect or weapon was or wasn't in the room. The suspect chosen in the suggestion is moved to that room.

A player can, on their turn, make an interrogation, wherein they can choose a suspect, a weapon, and a room. A longer vignette is shown, playing out the scenario as the player chose. Example: ""The lounge was warm. It was cozy enough for a nap... A long nap. Miss Scarlet laughed as she fixed her hair. She picked up the pipe."" At this point, one of the other players, if they are in possession of a card that eliminates any of those factors, shows on screen that they have proof that the scenario could not have happened. If none of the other players are in possession of such a card, the interrogating player is not proved wrong. Players may make two interrogations per game.

A player can, on their turn, make an accusation, which plays out similar to an interrogation, unless if the player is incorrect, they are eliminated from the game. If they are correct, the actual suspect is seen killing Mr. Boddy in an addition to the vignette and is then seen being arrested. The accusing player is the winner."
"Congo","","Region Not Set","","","Visual Concepts","1995-03-01","1","No","Action","Not Rated","The game was canceled due to development problems, a prototype is still available."
"Contra: The Hard Corps","Contra - The Hard Corps","NTSC-J","Japan","Konami","Konami","1994-09-15","2","Yes","Action | Shooter","T - Teen","Set five years after the events of Contra III: The Alien Wars, a terrorist group led by the renegade Colonel Bahamut has stolen an alien cell recovered from the war and now intends to use it to produce weapons. A new task force, known as the titular ""Hard Corps"", are sent to deal with the situation. The game features a branching storyline with multiple possible endings."
"Curse","","Region Not Set","","Micronet Co. Ltd.","Micronet Co. Ltd.","1989-12-23","1","No","Action | Shooter","E - Everyone","Curse (カース) is a 1989 Sega Mega Drive shoot-'em-up by Micronet released exclusively in Japan. You play as a ship that has to save an alien planet from destruction caused by a neighboring planet that had mysteriously changed from friend to enemy over the course of centuries."
"Cyberball","","Region Not Set","","","","1990-06-01","1","No","Sports","Not Rated","Cyberball brings this fast and furious action to life. Gameplay is essentially the same as the real sport, although the 'downs' are replaced by the bomb's heat gradually increasing towards 'critical'. After this it will explode and possession will be swapped. This is prevented when you cross the 50-yard line, lose possession or score a touchdown, in which cases it resets to 'cool'. Field goals and punts are not featured - the only kick is the initial kick-off you receive."
"Cyborg Justice","","Region Not Set","","Sega","","1993-02-18","2","Yes","Platform","","In the near future, anarchy reigns supreme and nobody is safe. Cyborgs control the streets and they enforce their rules the only way they know how: through CYBORG JUSTICE. Now's your chance to create your very own cyborg and enter it in the ultimate fighting competition. You can mix and match parts for your cyborg to form a fighting machine that matches your fighting style. 

There are 216 different cyborg possibilities in all, meaning you're sure to find one that fits your needs. Whether you plan to use weapons, hand-to-hand combat, or an even mix of the two, you'll have quite a fight on your hands once you step into the arena. And if you long for some human competition, challenge a friend to a duel so you can determine who can really deliver CYBORG JUSTICE."
"DaemonClaw: Origins of Nnar","Daemon Claw Origins of Nnar","NTSC","","Sega","","2025-06-02","1","No","Action","E - Everyone","You're humanities last hope. Given the magic gauntlet DaemonClaw, which takes unique forms and gives you powers best suited for the foes you face. high speed side scrolling classic console and arcade style action game. 

Bash your way through an array of distinct landscapes, through swarms of unique enemies with your magically enhanced abilities which adapt to the strengths and weaknesses of the enemies you face in each level."
"Death Duel","","Region Not Set","","RazorSoft, Inc.","Punk Development","1992-01-01","1","No","Shooter","","Taking place in the future year 2140, the nine of the ten Galactic Federations had gained unwarranted control over galaxy flight traffic and territory. This has caused the one remaining Federation to suffer a loss of supplies and space pirate attacks. The dispute can only be settled through a warranted duel with the Federation’s one duelist to fight against the collective nine alien duelists representing the nine Galactic Federations in control of the space traffic ways, otherwise known as The Super 9’s. The player assumes the role of Barrett Jade, a mecha pilot to win back the space ways and duel against the nine other duelists.

Players started the game off with their first duel with a set number of ammunition for their weapons; the player’s robot had a total of three weapons indicated by all three buttons on the controller. Once the player completed the duel, they would go through a type of Bonus Stage that would qualify them for the next duel as well as increase their score and money. Players could then purchase more ammunition or even new weapons for their robot at a local shop. Players had to time their attacks and aim precisely for key locations of their opponents body. Some enemies could regenerate missing parts of their body (including their head) while some enemies depended on particular mechanical parts to evade fire. If the player ran out of ammunition for all their weapons before the duel was over, they would lose a life and restart the duel over (with the same amount of ammunition they started the duel with). If the duel timer ran out before the duel was over, the player would also lose a life and restart the duel."
"Dial Q wo Mawase!","ダイヤルQをまわせ！","Region Not Set","","","","1992-01-01","1","No","Sports","AO - Adult Only 18+","Dial Q o Mawase! (ダイヤルQをまわせ！), alternatively called Dial Q wo Mawase! and often pirated under the name Kyuukyoku Mahjong or Mahjong Lady, is a pornographic mahjong game for the Sega Mega Drive originating in Japan, but developed by unknown developers in some unknown year. The game is somewhat often pirated by other Japanese and Chinese pirates. It appears to be hacked out of Mahjong Cop Ryuu and steals the Cube/Noriyuki Iwadare sound driver."
"Dominus","","Region Not Set","","Asciiware","Virtual Concepts","1993-01-01","1","No","Strategy","","Dominus is an unreleased Sega Mega Drive strategy game developed by Virtual Concepts and set to be published by Asciiware. It was cancelled for unknown reasons, though a IBM PC port published by U.S. Gold was released in 1994. A SNES version was also planned but suffered a similar fate.

A prototype ROM, dated 1993 has since been unearthed, showing an incomplete game without any sound."
"Double Dragon V: The Shadow Falls","","Region Not Set","","Tradewest, Inc.","Leland Interactive Media","1994-08-01","","No","Fighting","","The Shadow Master, who has created a deadly virus which he plans to destroy the world with, is waiting for you at the end of the path to victory. You'll have to fight your way through many evil characters before you face the Shadow Master. Beat him, and the world is saved for another day."
"Dyna Brothers 2: Sega Channel Special","","Region Not Set","","Criterion Games","Criterion Games","1995-06-01","","No","Strategy","","A special version of Dyna Brothers 2 only released on Sega Channel in Japan for the Sega Mega Drive."
"Earthion","Earthion","NTSC","","Limited Run Games","Ancient","2025-07-31","1","No","Action | Shooter","E - Everyone","Return to the genesis of 16-bit gaming with Ancient's brand new shoot 'em up, Earthion!
Yuzo Koshiro’s Earthion is a side-scrolling space shooter developed natively for 16-bit systems by legendary Japanese developer Ancient Corporation. 

Guide space fighter pilot Azusa Takanashi, through eight chaotic levels, each with their own unique environment, enemies, and boss fights, to repel the alien invaders and save planet Earth."
"Exile","","Region Not Set","","Renovation Products, Inc.","Telenet Japan","1991-12-01","","No","Action | Adventure | Role-Playing | Platform","","Exile is a sequel to XZR. Like its predecessor, it is an action role-playing game with platforming elements, set in a fictionalized version of the Middle East and other world regions in 13th century. Travel and exploration occur in the traditional overhead view of RPGs, while the battles and dungeons are side-scrolling mazes, similar to Wanderers from Ys. Experience points are awarded for defeating enemies. Leveling-up automatically raises Sadler's attributes. Sadler fights with swords and can also cast offensive and restorative spells. Weapons, armor and items can be bought and sold in towns."
"F-117 Night Storm","","Region Not Set","","EA Games","EA","1993-07-01","","No","","","This game allows the player to take control of an F-117A Stealth Fighter. The game is broken down into either an arcade or campaign mode.

In the arcade mode, the player can decide the number of enemy air and ground units, the environment, length of mission, and the difficulty level. This mode allows the player to hone their skills in order to prepare for the campaign mode. 

The campaign mode is the main part of the game and contains 30 missions. The game includes nine theaters of combat such as training missions in the Nevada Desert, to the conflict in Panama, and also to the Gulf War. Each mission has a primary object that must be destroyed in order to advance to the next mission."
"F1 World Championship","","Region Not Set","","Domark Group Ltd.","Parkstar Software","1993-01-01","2","No","Racing","E - Everyone","F1 is an Official Formula One Racing Game. There are two modes of play available: ""Arcade"", ""Grand Prix"". In both of these modes you complete a certain number of laps (4, 8, or 12) and select which circuit that you want to race on. The circuits include San Marino, France, Britain, Germany, Italy, Portugal, Japan, and Australia. Some circuits are easy, while some are difficult. 

There are slight differences between the two modes. For instance, ""Arcade"" allows you to select the circuit in any order that you like, whereas ""Grand Prix"" only allows you to fine-tune your car before starting a race. You also need to race a circuit in the order that they appear on the circuit selection screen, but you can skip a track if you want."
"Fantastic Dizzy","","Region Not Set","","Codemasters","The Oliver Twins","1993-01-01","1","No","Action | Puzzle | Platform","E - Everyone","Fantastic Dizzy (The Fantastic Adventures of Dizzy outside Europe & Australia) is a 1991 video game developed by Codemasters. It was published to several platforms, including Sega Mega Drive/Genesis, Master System, Game Gear, NES,[1] Amiga and DOS.

The game was originally intended to be released in time for Christmas in 1990, but because of a legal action between Codemasters and Nintendo over the Game Genie the title was released in April 1991, making it miss the Christmas rush it was originally slated for. Furthermore only sold 125,000 units instead of the expected 500,000.[citation needed] Despite this, the game was awarded the 'NES Adventure Game of the Year 1991' by Game Players Magazine and given the coveted 'Parents Choice Award'.[citation needed]"
"Fantastic Dizzy and Cosmic Spacehead Double Pack","","Region Not Set","","Codemasters","","1994-01-01","1","No","Action | Puzzle | Platform","E - Everyone","Enjoy the excitement of two classic Codemasters games on one cart! It's action and adventure all the way with Fantastic Dizzy and Cosmic Spacehead!"
"Fatal Rewind","The Killing Game Show","Region Not Set","","","","1991-11-01","1","No","Action","Not Rated","The Killing Game Show is a run and gun shooter game developed by Raising Hell Software for the Amiga and Atari ST. It was released in 1990 and published by Psygnosis. It was re-released later under the name Fatal Rewind for the Sega Genesis and published by Electronic Arts. The music and sound effects for the game were created by Ray Norrish. The main character of the game later made cameos in Leander and Wiz 'n' Liz."
"Ferias Frustradas do Pica-Pau","","Region Not Set","","Tec Toy Indústria de Brinquedos S.A.","Tectoy","1995-10-01","1","No","Action | Platform","Not Rated","Férias Frustradas do Pica-Pau (roughly translated as Woody Woodpecker's Frustrated Vacations) is a platform game developed and published by Tectoy and released exclusively in Brazil for the Sega Mega Drive and Sega Master System. It stars cartoon character Woody Woodpecker on a quest to save his friends.

Férias Frustradas do Pica-Pau is unusual in that it keeps a non-shaded cartoon style throughout the entire game."
"Fido Dido","","Region Not Set","","Kaneko Co., Ltd.","Teeny Weeny Games, Ltd.","1994-01-01","1","No","Action | Platform","","Fido Dido is a game platform on the Megadrive. The player Fido worlds through drawings from the author. Each level has its own goals and its own objects that the player must make the best use to get rid of enemies and obstacles which stand in the way."
"Final Zone","FZ Senki Axis","Region Not Set","","Wolf Team","Wolf Team","1990-01-01","1","No","Action | Shooter","","The player assumes the role of Howard Bowie, the hero soldier of the El Sharia Military Nation's foreign legion and commander of the unit known as ""Team Undead"". It is 100 years in the future and weapons of mass destruction have been banned from the field of war. Fighting is now done with the futuristic power armor known as the New Age Power Suit (NAP). Howard is assigned to use his K-19 Phantom NAP to infiltrate enemy territory to Point A-46K Bloody Axis and destroy the sole remaining weapon of mass destruction."
"Fix It Felix Jr.","","Other","","","Airwalk Studios","2014-01-01","1","No","Action","Not Rated","In the quarter-muncher Fix-It Felix Jr., the thick-headed thug Wreck-It Ralph tries to destroy a building while the daring do-gooder Fix-It Felix repairs the damage with his magic hammer.

This ""arcade"" game is the basis of the Disney animated movie Wreck-It Ralph. In the film, Ralph is the bad guy, but that doesn't mean he is a ""bad"" guy, -- it's just his job to be a heartless demolisher so that Felix can save the day. But countless games where Ralph has played the villain has taken its toll, and after becoming the outcast of his mostly-wrecked town, Ralph is ready to look for more out of his pixelated life.

Fix-It Felix Jr. is seen in the movie Wreck-It Ralph, and Disney has produced promotional display cabinets as part of the marketing of the film. Whether this arcade game itself will be released for the public to play is unknown at this time; a web version of the game is playable courtesy of Disney."
"Flux","","Region Not Set","","Virgin Games, Ltd.","EXP","1995-08-28","","No","","","Flux is a music visualizer software developed by EXP for the Sega Mega Drive and released by Virgin Interactive exclusively in Europe. When the Mega Drive is connected to a Sega Mega-CD, an audio CD is in the CD tray, and this cartridge in the Mega Drive, Flux will have the Mega CD play the music on the CD and show various user-configurable effects (the default being a two-channel oscilloscope). B pauses playback, Left and Right skip tracks, and Start brings up the configuration panel.

The cartridge works for two reasons — the Mega CD supports using a cartridge as a boot image (this was also done with Wonder Library) and supports having the boot image access the CD drive for audio playback. Kega Fusion can emulate all this specifically for Flux; instructions are in its readme file. It requires a small modification to its configuration file and a European Mega CD BIOS to work."
"FX Unit Yuki: The Henshin Engine","FX Unit Yuki - The Henshin Engine (World) (Aftermarket) (Unl)","Other","","","","2018-01-01","1","No","Platform","Not Rated","No overview is currently available for this title, please feel free to add one."
"Game Factory","","Region Not Set","","Sega","Sega","1994-08-10","1","No","Sandbox","Not Rated","Game Factory was a service offered by Blockbuster Video in the United States for a short period after 1994. It was a joint venture between Blockbuster, Sega of America and the Blockbuster-IBM project New Leaf Entertainment (and manufacturing subsidiary Fairway Technologies).

The concept involved customers renting Sega Mega Drive video games stored on reprogrammable flash cartridges. Avoiding the need to stock potentially hundreds, if not thousands of official video game cartridges for rent, Blockbuster could instead use a Game Factory cartridge, flash the contents of a ROM image onto the memory inside, and distribute that instead. When the customer had finished borrowing the game, the cartridge could then be flashed with another ROM image and be recycled for further use"
"Goofy's Hysterical History Tour","","Region Not Set","","Absolute Entertainment","Imagineering Inc.","1993-01-01","1","No","Action","E - Everyone","In Goofy's Hysterical History Tour, the player takes command of Goofy himself who gets his dream job as janitor at The Ludwig von Drake History Museum. However, his rival Pete is determined to get him fired and sabotages the exhibits and scatters pieces throughout various time periods. Armed with a new gadget, the Extend-O-Hand, Goofy must travel to the past and recover the pieces before the morning.

The game is a platformer, where Goofy must travel through various stages ranging from Prehistoric times, Medieval times, Colonial America and the Wild West among many others, collecting items and power-ups and defeating Pete's henchmen using the Extend-O-Hand. After collecting all the pieces, Goofy then must face Pete himself."
