title,alternate_titles,region,country,publisher,developer,release_date,players,coop,genre,esrb_rating,description
"GRIND Stormer","","Region Not Set","","Tengen","Toaplan Co., Ltd.","1994-07-01","2","No","Shooter | Flight Simulator","","In this hectic, top-down, vertically-scrolling shooter where the screen is constantly filled with enemies and bullets, players have a constant, unlimited firing rate, enhanced by power-ups that include missiles, target-seeking bullets, shields, additional speed, extra power and bonus points. In Grind Stormer the ship always moves at a fast speed and the player can collect bombs that damage the entire screen and fend off bullets. The other variant V Five takes a Gradius-approach to power-ups, having the player advance through a selection of power-ups shown on the right by collecting tokens. In the first mode power-ups are immediately applied. In the second mode the ship is much slower and the player needs to decide to spend tokens on speed power-ups right away or save them to advance to seeking bullets or additional power."
"Growl","Runark","Region Not Set","","Taito Corporation","Taito Corporation","1991-01-01","4","No","","","Growl, known in Japan as Runark, is a belt-scrolling beat-'em-up originally released for the arcades by Taito in 1990. Set in the early 20th century, the player controls a forest ranger who must protect the local wildlife from a group of evil poachers who are driving the animals to extinction. A home version was released for the Sega Genesis (Mega Drive) on November 1991. It was also included in the arcade game compilation Taito Legends 2 for the PlayStation 2, Xbox and Microsoft Windows."
"Gunship","","Region Not Set","","MicroProse Software, Inc.","MicroProse Software, Inc.","1993-01-01","1","No","Flight Simulator","","Gunship is a helicopter action game developed by Microprose published by U.S. Gold for the Sega Mega Drive. It was only released in PAL regions."
"Hard Drivin'","","Region Not Set","","","","1990-12-21","2","No","Racing","E - Everyone","Hard Drivin '​ is a driving arcade game that invites players to test drive a high-powered sports car on stunt and speed courses. The game featured one of the first 3D polygon driving environments[3] via a simulator cabinet, rendered with a custom architecture.[4] The force feedback, car physics simulator, game design and most game programming were done by Max Behensky.[citation needed] According to the in-game credit screen, Hard Drivin' was designed by two teams working concurrently in the United States and Ireland.

Development began in 1988. Atari also originally intended to release the game in 1988. However, according to one of Atari's Engineer and designer, it was delayed due to the dispute from its Vice President claiming that no one would buy an arcade cabinet for $10,000 after The Last Starfighter arcade game was canceled for the same reason a few years ago earlier. After weeks of research, it was decided that $10,000 was an acceptable price point.[5] [6] [7]

Hard Drivin '​ was released in February 1989,[1][3][8] when arcade driving games were largely implemented with scaled 2D sprites, such as Pole Position and OutRun, and when filled-polygon 3D graphics of any kind were rare in games. Hard Drivin '​ is the second commercially released arcade racing game to use 3D polygons, after Winning Run.

In total, there are fifteen variations of the arcade unit. The eleven cockpit and four compact machines included various British, German and Japanese versions.

Hard Drivin' sold 3,318 video game arcade cabinets.[1] The PC games Stunt Driver and Stunts were released after Hard Drivin '​ and shared many elements with it."
"Hardball '94","","Region Not Set","","","","1994-07-01","1","No","Sports","Not Rated","New features in this edition of the baseball simulation include the Home Run Derby and Pitching Practice. Multiple viewpoints and instant replays are included. 28 pitches are included, each with distinct effects. You can use real or fictitious teams, and even create your own right down to the logo and kit. Statistics such as batting average and RBIs are stored and can be printed out. Also, as in the previous game, announcer Al Michaels says things during the game."
"Haunting Starring Polterguy","","Other","Brazil","Tec Toy Indústria de Brinquedos S.A.","EA","1994-01-01","2","Yes","Life Simulation | Horror","T - Teen","No overview is currently available for this title, please feel free to add one."
"Havoc","","Region Not Set","","Data East Corporation","Data East Corporation","1994-04-22","1","No","Action","","The story is about an anthropomorphic pirate seal named Havoc (Lang in the Japanese version), his young sidekick Tide (Land in the Japanese version), a girl named Bridget, and an evil pirate named Bernardo.  Bernardo is looking for Emeralda, a gem with powers that can cause whole armies to be toppled. A map shows where Emeralda is located, and Bernardo is looking for the map. Havoc and Tide discover Bridget unconscious at a beach. When she wakes up in a dwelling, she instructs Havoc to keep her and the map safe. Havoc hides the map in a cliff. After Bernardo's henchmen kidnaps Bridget and Tide; Havoc, the playable character, sets off to rescue them."
"Hei Tao 2: Super Big 2","","Region Not Set","","","ChuanPu Technology Co.","1996-01-01","1","No","Puzzle","Not Rated","Hei Tao 2: Super Big 2 (黑桃2) is an unlicensed game for the Sega Mega Drive made by Chuanpu in some unknown year and (most likely) published in Taiwan by King Tec Information Co., Ltd.. The game is an implementation of the card game Big 2. You can play as one of eight characters."
"Hellfire","","Region Not Set","","Seismic Games","Toaplan Co., Ltd.","1990-01-01","1","No","Action | Shooter","E - Everyone","In the year 2998, humanity has finally reached the stars, and was able to build a prosperous, peaceful society. However, a space matter known as the Black Nebula began to spread, threatening to engulf the galaxies controlled by humans. It turned out that a robotic dictator named Super Mech was behind this occurrence. The Earth sends Captain Lancer, a skillful pilot navigating the powerful CNCS1 aircraft, equipped with the most powerful weapon: the Hellfire...

This is a horizontal space shooter, with the traditional premise of a lone pilot traversing hostile areas and out-manoeuvring and/or destroying quick and numerous enemies. What sets this shooter apart from many other horizontal space shooters is that you choose the direction of your shots at any time between forward, backward, upward+downward and 4-way diagonal. The 4-way diagonal shot is usually the most effective and makes for some interesting gameplay setups, such as stationary guns you can only reach by passing them (while avoiding their shots) and then placing yourself diagonally above them. There is also a bomb to take out multiple enemies. The game has a standard set of pickups: P icons for powering the weapons, S icons for increasing ship speed, B icons for bombs, and score icons."
"Home Alone","","Region Not Set","","","","1992-01-01","1","No","Action","E - Everyone","As young Kevin McCallister, you have mistakenly been left home alone this Christmas by your family. The big problem here is that a couple of bumbling burglars have set their sights on the McCallister belongings as their ultimate heist. You're the only thing that stands in their way and they're not about to negotiate. Scramble through the house, basement and tree fort while setting incredible traps for the unwanted intruders! Bounce chandeliers and irons off their noggins in an attempt to gain valuable time for yourself as the police race to your rescue. Can you keep out of Marv and Harry's clutches and protect your family's treasures? Find out in this hilarious adaptation of the classic comedy hit of the year!"
"Hua Mu Lan: Mulan","","Region Not Set","","","","2000-01-01","1","No","Action | Platform","Not Rated","Hua Mu Lan: Mulan is an unlicensed action game by some unknown developer for the Sega Mega Drive made some unknown year. It is based on either the Chinese legend of Hua Mulan or the 1998 Disney film of the same name — which it steals art from, giving us a potential earliest release date. Some of its music is stolen from another unlicensed game, Chuanpu's 1996 Ya Se Chuan Shuo; whether or not the rest is also stolen has yet to be determined.

Interestingly enough, the game has a story screen... in Chinese, English, Spanish, Portugese, and Arabic. The stories appear to be identical: during the Tang Dynasty, the Hun warlord Tan-Yu led his soldiers to seize the dynasty, and Tang conscripts all men to fight the oncoming forces. Hua Mulan, not wanting to see her old father fight, goes in to fight for him.

The game is a typical platformer. B attacks and C jumps."
"Huan Le Tao Qi Shu: Smart Mouse","","Region Not Set","","","","1994-01-01","1","No","Puzzle","Not Rated","Huan Le Tao Qi Shu: Smart Mouse (歡樂淘氣鼠) is a Sega Mega Drive game developed by several Taiwanese developers in some unknown year. While the name of the dev team is never given, there is a staff list — much of the staff come from Chuanpu, but there's no confirmation this was one of their products. Some of the music is also stolen from Wonder Boy III: Monster Lair, whose sound driver the game uses.

The game itself is a basic Pengo clone — the goal is to destroy all the enemies in the stage without getting hit. A pushes a block."
"Hurricanes","","Region Not Set","","U.S. Gold Ltd.","U.S. Gold Ltd.","1994-06-01","1","No","Action","EC - Early Childhood","Hurricanes is a 1994 platformer for various systems, including the Sega Mega Drive and Sega Game Gear, by U.S. Gold based on DiC's Hurricanes cartoon. The MD and GG versions were only released in Europe (a SNES port developed by Probe was released in the US). Each version has different levels."
"Hyperdunk","","Region Not Set","","Konami","Konami","1994-03-04","4","No","Action | Sports","E - Everyone","With the help of Sega's Team Player Adaptor peripheral, up to eight different players can play the game. The three modes of play are Exhibition, Multi-Play, and Playoff. In Playoff Mode, one team is selected and placed in a tournament bracket. The first round is a best-of-5 series while the remaining rounds are best-of-seven. Passwords are given during the semi-final round.

Each player has a separate gauge that determines their energy level in addition to how effective that they are with their shots. Unlike the NBA or NCAA college basketball, the shot clock is shown in milliseconds in addition to seconds. Each player is shown with an identical height and weight to all the other players in-game.

Instead of four teams like the original, players can choose to be one of the 16 teams which vaguely resemble teams from the National Basketball Association. The team name for each city corresponds to the culture of each venue."
"I Love Mickey & Donald: Fushigi na Magic Box","アイラブ ミッキー＆ドナルド ふしぎなマジックボックス | I Love Mickey & Donald: Mysterious Magic Box | World of Illusion Starring Mickey Mouse and Donald Duck","NTSC-J","Japan","Sega","Sega CS R&D 2","1992-12-18","2","Yes","Platform","E - Everyone","I Love Mickey & Donald: Fushigi na Magic Box is a 1992 Mega Drive video game developed by Sega CS and released by Sega in Japan on December 18, 1992."
"IMG International Tour Tennis","","Region Not Set","","EA Sports","EA","1994-05-21","","No","Sports","","Licensed by the International Management Group (IMG), this rare Electronic Arts venture into Tennis features 32 professional players (all male and licensed by the IMG) including Bjorn Borg, Marcelo Rios, Patrick Rafter and Yevgeni Kafelnikov in 15 tournaments with different surfaces. Game modes include exhibition, tour and tournament for both singles and doubles.

Along the usual offering of lobs, volleys, passing shots, top spins and slashes, the player can leave player movement to the console, and just focus on hitting the ball with the right shot with the correct timing (the player can also set the playing style, from all-court, baseline, or rush net). For those needing a boost of confidence before entering competitive play, Vic Braden, one of the most well known tennis coaches, has a court with special lines, a ball machine and some hints to help them improve their play."
"Insector X","","Region Not Set","","Taito Corporation","Sage's Creation, Inc.","1990-01-01","1","No","Action","","They're gonna bug ya... to DEATH! Compared to these guys, killer bees are about as scary as a butterfly. In this awesome insect Empire you've got to be a fast gun! No can of bug spray will help you here. These giant mechanized insects mean business. Become too enthralled with the beautiful landscape and your daydreams could become a nightmare! Become... Insector X! A moment's delay could be your last!!"
"Jim Power: The Arcade Game","","Region Not Set","","Sega","Loriciel","1993-11-01","1","No","Action | Adventure | Shooter","Not Rated","Jim Power: The Arcade Game is a Shoot-'Em-Up game, developed and published by Loriciels, which was cancelled before it was released."
"Jordan vs Bird","Jordan vs. Bird: One on One","Region Not Set","","EA Games","EA","1989-02-10","2","No","Sports","E10+ - Everyone 10+","Many people would argue that Larry Bird is the greatest player in the history of the NBA, while others would say that Michael Jordan is the best, hands down. Now you can settle that debate by matching them up in a one-on-one affair with JORDAN VS. BIRD"
"Kunio no Nekketsu School Fighters","River City Fighters | Kunio no Nekketsu School Fighters - River City Fighters | Kunio no Nekketsu School Fighters : River City Fighters | Kunio no Nekketsu School Fighters: River City Fighters | River City Fighters - Kunio no Nekketsu School Fighters | River City Fighters : Kunio no Nekketsu School Fighters | River City Fighters: Kunio no Nekketsu School Fighters","Other","","","","2023-04-09","2","No","Fighting | Unofficial","Not Rated","""Kunio no Nekketsu School Fighters"" AKA ""River City Fighters"" is an unofficial adaptation of the ""River City Girls"" series into a 1v1 fighting game exclusive to the Mega Drive/Genesis.

Students from rival schools gather in secret, far from prying eyes, to settle once and for all who is truly the strongest. Each fighter brings their own style, attitude, and school pride to the underground matches, creating an intense clash of power, skill, and spirit. Step into the hidden arenas and prove your strength in this underground battle for supremacy!"
"Langrisser","ラングリッサー | Warsong","Region Not Set","","Masaya","Career Soft","1991-04-26","1","No","Role-Playing | Strategy","E - Everyone","Langrisser (Japanese: ラングリッサー, Korean: 랑그릿사) is a turn-based strategy RPG developed by CareerSoft, a division of NCS. It is the first game in the Langrisser series and the only game to be released outside Japan and Korea — released in the US by Treco under the name Warsong."
"Last Action Hero","","Region Not Set","","Sony Imagesoft","Bits Studios","1993-11-01","1","No","Action","Not Rated","Danny Madigan is watching a sneak preview of the latest film of his favourite hero, Jack Slater, when he is mysteriously catapulted inside the screen; now standing next to his favourite idol. You are Jack Slater, an action movie hero, who takes on the ax maniac “The Ripper”, who is holding a school under siege, and Benedict, a villain who wants to use Danny’s ticket to bring terror to the real world."
"Madden NFL '92","John Madden Football 92 | John Madden '92 | John Madden 92 | Madden Football '92 | Madden Football 92 | Madden '92 | Madden 92 | John Madden Football '92","Region Not Set","","","","1992-01-01","1","No","Sports","Not Rated","John Madden Football '92, released as Pro Football in Japan, is a football video game. It features John Madden on the cover. Madden Football '92 is the sequel to John Madden Football. New aspects of this version include instant replay, two-player cooperative play, quarterback injuries, review and overturn pass interference calls, and more audibles. There are also new play modes, such as pre-season games, regular season games, playoffs, and sudden death. Quarter lengths have been adjusted in this version to be set at 5, 10, or 15 minutes. As in previous versions of the video game, there are no NFL or NFLPA licenses for authentic teams, player names, and stadia. Teams are organized by city name and colors.

MegaTech gave the game 95% and a Hyper Game Award, saying that ""you'll enjoy it, even if you don't care much for the sport"".[1] In October 1992, Mega placed the game at #1 in their Top Mega Drive Games of All Time.[2]"
"Madden NFL '95","Madden NFL 95 | Madden '95 | Madden 95","Region Not Set","","Electronic Arts","High Score Productions","1994-01-01","4","No","Sports","E - Everyone","Play exhibition, Super Bowl, playoffs or full season with any of the 1994 teams or all Madden teams.

This time around, you can select whether or not to include weather conditions, new player animations (high steppin', QB slides), a bigger field and over 100 injuries.

Also includes windowless passing, all new Madden-designed strategies and team match-up that shows how your players stack up to the other team in their position."
"Mario Andretti Racing","","Region Not Set","","","","1994-10-01","1","No","Racing | Sports","Not Rated","Mario Andretti Racing is a video game that was released in 1994 on the Sega Genesis/Mega Drive. It was an early title in the newly created EA Sports line, and was developed by Stormfront Studios. The game was produced by famed sports game developer Scott Orr as part of his collaboration with Richard Hilleman in the creation of EA Sports. Race driver Mario Andretti personally guided the development of the AI used by the non-player drivers in stock cars, Indy style open wheel racing, and dirt track racing.

The game's greatest innovation was the presence of different physics and AI for three kinds of racing in one cartridge.

The success of Mario Andretti Racing led Orr and Hilleman to work with Stormfront to launch the highly successful NASCAR Racing series, which continues as one of the best-selling franchises in the EA Sports lineup today.

Another game starring Andretti, called Andretti Racing, was released for the Sega Saturn, PlayStation in 1996, and for PC in 1997."
"Marsupilami","","Region Not Set","","Sega","Sega","1995-01-01","1","No","Action | Platform","Not Rated","Marsupilami, a small furry marsupial with a tail with as many uses as a swiss army knife, must help his friend, Bonelli the elephant, across the world, returning him safely to his native home.Collecting Marsu's children along the way, you must solve puzzles, fight enemies and avoid traps, all with the aid of Marsu's incredible, ingenious tail!"
"Mega Games 6","","Region Not Set","","Sega","Sega","1995-01-01","2","No","Action | Adventure | Puzzle | Racing | Fighting | Sports","","Mega Games 6 is a compilation of six Sega Mega Drive games, distributed with some European Mega Drive II consoles in 1995. It is actually a combination of two previous pack-in games, Mega Games 1 and Mega Games 2. It would be followed by Mega Games 6 Vol. 2 and Mega Games 6 Vol. 3."
"Mega Games 6 Vol. 2","Mega Drive Six Pack","Region Not Set","","Sega","Sega","1995-01-01","1","No","Action | Puzzle | Racing | Sports","Not Rated","Mega Games 6 Vol. 2 is a compilation of six Sega Mega Drive games, distributed with some Mega Drive II consoles in 1995. It was also released under the name Six Pack."
"Mega Games 6 Vol. 3","","Region Not Set","","Sega","Sega","1995-01-01","2","No","Action | Puzzle | Racing | Fighting | Sports | Platform","Not Rated","Mega 6 Vol. 3 is a compilation of Sega Mega Drive/Genesis games released in PAL territories during 1995, and was included as part of the console's late official bundles. The cartridge was the final release in the series of Mega Games compilations, and contains 6 of Sega's most successful games from the early days of the Genesis. It is the only volume of the Mega Games 6 series to introduce a new game to the Mega Games range, and the only Mega Games release to use the shortened Mega 6 title. The game came with individual instruction manuals for each game rather than integrating them all into a single manual. This compilation utilises the standard game selection screen seen in previous Sega compilation releases, including the Mega Games series, Classic Collection and Sonic Classics."
"Mega Games 6 Volume 3","mega 6 vol. 3","Region Not Set","","Sega","Sega","1995-01-01","2","No","Puzzle | Racing | Fighting | Sports | Platform","E - Everyone","Mega 6 Vol. 3 is a compilation of Sega Mega Drive games released in PAL territories during 1995, and was included as part of the console's late official bundles. The cartridge was the final release in the series of Mega Games compilations, and contains 6 of Sega's most successful games from the early days of the Mega Drive.

It is the only volume of the Mega Games 6 series to introduce a new game to the Mega Games range, and the only Mega Games release to use the shortened Mega 6 title. The game came with individual instruction manuals for each game rather than integrating them all into a single manual. This compilation utilizes the standard game selection screen seen in previous Sega compilation releases, including the Mega Games series, Classic Collection, 6-Pak and Sonic Classics. 

Games:
Sega Soccer,
Super Monaco GP,
Columns,
Sonic The Hedgehog,
Streets Of Rage"
"Megagames","","Region Not Set","","","","","","No","","","No overview is currently available for this title, please feel free to add one."
"Menacer","","Region Not Set","","","","1992-01-01","1","No","Shooter","","The Menacer 6-Game Cartridge is a cartridge containing six light gun games for use with the Sega Menacer. The Menacer came bundled with this cartridge, and predictably it is not compatible with any other Mega Drive peripheral.
Included games:

Pest Control
Space Station Defender
Ready, Aim, Tomatoes!
Whack Ball
Front Line
Rockman's Zone"
"Metal Gear","Metal Gear","NTSC","","Konami","Konami","2025-05-14","1","No","Action | Shooter | Stealth","E - Everyone","The Meta Gear port released for the Amiga now available for the Sega Mega Drive!."
"Metal Gear (Genesis Mega Drive)","","NTSC","United States of America","","","2025-05-13","1","No","Action | Adventure | Strategy","Not Rated","Metal Gear now for Genesis Mega Drive.
The same story as the NES MSX, but with the graphics of the 16-bit Sega."
"Metal Slug Warfare","Metal Slug Warfare","NTSC","","SNK","SEGA Games","2023-10-18","1","No","Action | Shooter","T - Teen","A special adaptation of the famous SNK's classic Run'n'Gun for the amazing SEGA Megadrive/Genesis!! 

A typical survival / Scoring funny gameplay with frantic action and progressive difficulty !

A special Ranking system !

Try to free the prisoner to gain a whole arsenal of powerful weapons !!

Fight against various enemies as well as air units !
Your best scores will be saved for challenges with your friends ( Need SRAM support  ! )

FM Musics by Vetea & MrData, SFX by Vetea.
Code by Vetea. Powered with the famous  SGDK by Stephane Dallongeville."
"Mickey's Ultimate Challenge","","Region Not Set","","Hi-Tech Expressions, Inc.","Designer Software | 																WayForward Technologies","1994-04-08","1","No","Puzzle","Not Rated","Mickey's Ultimate Challenge is a puzzle game in which the player chooses either Mickey or Minnie to play with. They'll find five characters from the Disney's universe in the kingdom, and will be prompted to help them in several tasks.

Each task is a different puzzle, given by a specific character. Daisy, for instance, will ask help to clean the castle's paintings hanging on a wall. The task is in fact a memory game, where Mickey or Minnie must clean the pictures matching pairs. After completing one task, they'll receive a gift."
"MIG-29 Fighter Pilot","","Region Not Set","","Domark Group Ltd.","PanelComp","","1","No","Shooter | Flight Simulator","","MiG-29: Fighter Pilot takes place in the Middle East. The joined forces of NATO and the Commonwealth of Soviet States are to stop General Hasouz who is seeking to gain control over the world's oil resources. You are the pilot of the Russian-built MiG-29 and you need to accomplish several strategic missions to ensure the success of the operation."
"Might and Magic III: Isles of Terra","","Region Not Set","","","","1992-05-01","1","No","Role-Playing","Not Rated","Might and Magic 3 brought a lot of changes to the series formula. First off, it 3 is distinctly more narrative focused than the earlier games; it opens with a fully voiced sequence where your party is taunted by a mysterious figure, Sheltem, the barely-fleshed-out villain of the first two games, who is still knocking around. Although it's still possible to create new characters, the game is also the first in the series to start the player off with a pre-generated party, lead by the noble Paladin Sir Caneghem (named after the head designer of the game). This is also the first game in the series outside of the Macintosh versions of the games to support playing using a mouse."
